{
  "schema_version": "1.0.0",
  "account_context": "BOM",
  "public_name": "M5BOM",
  "tier": "TIER_I",
  "hardware_control": "HUMAN",
  "weights_location": "LOCAL",
  "billing_policy": "LOCAL_SOVEREIGN",
  "billable": false,
  "service_metering": "NONE",
  "usage_cap": null,
  "payment_required": false,
  "subscription_required": false,
  "telemetry_required": false,
  "hosted_routing_required": false,
  "network_required_for_inference": false,
  "periodic_account_check_required": false,
  "paid_fallback_default": false,
  "diagnostics_disable_preserves_inference": true,
  "account_suspension_disables_local_inference": false,
  "export_supported": true,
  "delete_supported": true,
  "infrastructure_costs_separate": true,
  "authority_effect": "NONE",
  "profile_id": "SYN-BASELINE-001",
  "principal_ref": "SYN-M5HUM-001",
  "account_ref": "SYN-BOM-001",
  "activation_receipt_ref": "SYN-ACCOUNT-ACTIVATION-001",
  "model_artifact_ref": "SYN-MODEL-001",
  "model_license_ref": "SYN-LICENSE-001",
  "model_artifact_hash": "sha256:0000000000000000000000000000000000000000000000000000000000000000",
  "ai_service_price_usd": "0.00",
  "diagnostics": "OFF",
  "infrastructure_estimate": null
}
